{
  "format": "ank-native/1",
  "book_id": "fixture-basic-nga-0001",
  "tid": 10000001,
  "author_id": 1,
  "title": "测试安科：契约样本",
  "author": "样本楼主",
  "folder_name": "10000001(1)",
  "per_chapter": 2,
  "image_mode": "online",
  "theme": "light",
  "toc_mode": "index",
  "toc": [],
  "chapters": [
    { "file": "chapters/0000.xhtml", "title": "序章 · 主楼", "floor_count": 1, "first_lou": 0, "last_lou": 0, "main": true },
    { "file": "chapters/0001.xhtml", "title": "第 1~2 楼", "floor_count": 2, "first_lou": 1, "last_lou": 2, "main": false },
    { "file": "chapters/0002.xhtml", "title": "第 3~4 楼", "floor_count": 2, "first_lou": 3, "last_lou": 4, "main": false }
  ],
  "last_lou": 4,
  "created_time": "2026-08-01 12:00:00",
  "updated_time": "2026-08-01 12:05:00"
}
