{
  "format": "ank-native/1",
  "book_id": "bookid123",
  "tid": 123,
  "author_id": 0,
  "title": "标题",
  "author": "作者",
  "folder_name": "toc_split",
  "per_chapter": 20,
  "image_mode": "online",
  "theme": "light",
  "toc_mode": "split",
  "toc": [
    {
      "title": "第一卷",
      "entries": [
        [
          "起点",
          1002
        ]
      ]
    },
    {
      "title": "第二卷",
      "entries": [
        [
          "起点",
          1015
        ]
      ]
    }
  ],
  "chapters": [
    {
      "file": "chapters/0000.xhtml",
      "title": "序章 · 主楼",
      "floor_count": 1,
      "first_lou": 1,
      "last_lou": 1,
      "main": true
    },
    {
      "file": "chapters/0001.xhtml",
      "title": "第一卷",
      "floor_count": 13,
      "first_lou": 2,
      "last_lou": 14,
      "main": false
    },
    {
      "file": "chapters/0002.xhtml",
      "title": "第二卷",
      "floor_count": 16,
      "first_lou": 15,
      "last_lou": 30,
      "main": false
    }
  ],
  "last_lou": 30,
  "created_time": "2026-01-01T00:00:00+08:00",
  "updated_time": "2026-01-01T00:00:00+08:00"
}